<?xml version="1.0" encoding="UTF-8"?>

<producers xmlns="stendhal" xmlns:xsi="http://www.w3.org/2001/XMLSchema-instance"
	xsi:schemaLocation="stendhal ../producers.xsd">

	<!-- Arlindo (Ados) -->
	<producer npc="Arlindo" slot="arlindo_make_pie" type="food">
		<welcome text="Witam! Założę się, że słyszałeś o moim słynnym placku. Mówiąc #upiecz zrobię go dla ciebie."/>
		<item name="tarta" minutes="7">
			<resource name="mąka" amount="2"/>
			<resource name="mięso" amount="2"/>
			<resource name="marchew"/>
			<resource name="pieczarka" amount="2"/>

			<activity type="make,zrób,upiecz"/>
		</item>
	</producer>

	<!-- Blacksheep Bob (Ados) -->
	<producer npc="Blacksheep Bob" slot="blacksheepbob_make_sausage" type="food">
		<welcome text="Hej! Witamy na naszym mięsnym targu Blacksheep. Czy mogę zrobić dla Ciebie paróweczki?"/>
		<item name="paróweczka" minutes="2">
			<resource name="truchło wampira"/>
			<resource name="truchło nietoperza"/>
			<resource name="mięso"/>
			<resource name="napój z winogron" amount="2"/>

			<activity type="make,zrób"/>
		</item>
	</producer>

	<!-- Blacksheep Harry (Ados) -->
	<producer npc="Blacksheep Harry" slot="blacksheepharry_make_tuna" type="food">
		<welcome text="Witamy na mięsnym targu Blacksheep. Czy mogę zrobić dla Ciebie prasowanego tuńczyka?"/>
		<item name="prasowany tuńczyk" minutes="2">
			<resource name="makrela"/>
			<resource name="okoń"/>
			<resource name="kolorowe kulki" amount="2"/>

			<activity type="make,zrób"/>
		</item>
	</producer>

	<!-- Blacksheep Joe (Ados) -->
	<producer npc="Blacksheep Joe" slot="blacksheepjoe_make_cheese_sausage" type="food">
		<welcome text="Witamy na mięsnym targu Blacksheep. Czy mogę zrobić dla Ciebie kiełbasę z serem?"/>
		<item name="kiełbasa serowa" minutes="2">
			<resource name="truchło wampira"/>
			<resource name="truchło nietoperza"/>
			<resource name="udko"/>
			<resource name="czarna perła"/>
			<resource name="ser"/>

			<activity type="make,zrób"/>
		</item>
	</producer>

	<!-- Linzo (Fado) -->
	<producer npc="Linzo" slot="linzo_make_fish_pie" type="food">
		<welcome text="Cześć, przyszedłeś spróbować moich rybnych placków? Mogę #upiec jeden dla Ciebie."/>
		<item name="tarta z rybnym nadzieniem" minutes="5">
			<resource name="mąka"/>
			<resource name="dorsz" amount="2"/>
			<resource name="makrela"/>
			<resource name="por"/>

			<activity type="make,zrób,upiecz"/>
		</item>
	</producer>

	<!-- Martha (Kalavan) -->
	<producer npc="Martha" slot="martha_bake_applepie" type="food">
		<welcome text="Cześć! Czy przyszedłeś, aby skosztować mojego pysznego jabłecznika? Mogę #upiec go dla Ciebie!"/>
		<item name="jabłecznik" minutes="15">
			<resource name="mąka" amount="2"/>
			<resource name="miód"/>
			<resource name="mleko"/>
			<resource name="jajo"/>
			<resource name="jabłko"/>

			<activity type="bake,zrób,upiecz"/>
		</item>
	</producer>

	<!-- Gertha (Kalavan) -->
	<producer npc="Gertha" slot="gertha_bake_cherrypie" type="food">
		<welcome text="Cześć! Czy przyszedłeś, aby skosztować mojego wspaniałego ciasta z wiśniami? Mogę z przyjemnością je dla Ciebie #upiec!"/>
		<item name="ciasto z wiśniami" minutes="15">
			<resource name="mąka" amount="2"/>
			<resource name="miód"/>
			<resource name="mleko"/>
			<resource name="jajo"/>
			<resource name="wisienka" amount="2"/>

			<activity type="bake,zrób,upiecz"/>
		</item>
	</producer>

	<!-- Gaston (Rat City) -->
	<producer npc="Gaston" slot="gaston_bake_crepesuzette" type="food">
		<welcome text="Witaj. Założe się, że przyszedłeś spróbować mojch pysznych #naleśników z polewą czekoladową! Mogę #upiec je dla Ciebie o ile chcesz."/>
		<item name="naleśniki z polewą czekoladową" minutes="5">
			<resource name="mąka"/>
			<resource name="mleko"/>
			<resource name="jajo"/>
			<resource name="osełka masła"/>
			<resource name="cukier"/>
			<resource name="tabliczka czekolady"/>
			<resource name="ekstrakt litworowy"/>

			<activity type="bake,zrób,upiecz"/>
		</item>
	</producer>

	<!-- Leander (Semos) -->
	<producer npc="Leander" slot="leander_make_sandwiches" type="food">
		<welcome text="Witaj w mojej piekarni, gdzie robię ciasto o zamorskiej nazwie #pizza oraz #kanapki!"/>
		<item name="kanapka" minutes="3">
			<resource name="chleb"/>
			<resource name="szynka"/>
			<resource name="ser" amount="2"/>

			<activity type="make,zrób"/>
		</item>
	</producer>

	<!-- Erna (Semos) -->
	<producer npc="Erna" slot="erna_bake_bread" type="food">
		<welcome text="Witaj w piekarni w Semos! Możemy upiec pyszny chleb dla każdego kto pomoże nam, przynosząc #mąkę z młyna. Powiedz tylko #'upiecz'."/>
		<item name="chleb" minutes="10">
			<resource name="mąka" amount="2"/>

			<activity type="bake,upiecz"/>
		</item>
	</producer>

	<!-- Kroip (Wo'fol) -->
	<producer npc="Kroip" slot="kroip_make_pizza" type="food">
		<welcome text="Witam! W czymś mogę #pomóc?"/>
		<item name="pizza" minutes="5">
			<resource name="mąka" amount="2"/>
			<resource name="ser"/>
			<resource name="pomidor"/>
			<resource name="borowik"/>
			<resource name="szynka"/>
			<resource name="pieczarka" amount="2"/>

			<activity type="make,zrób,upiecz"/>
		</item>
	</producer>

	<!-- Ernest (Gdańsk) -->
	<producer npc="Ernest" slot="ernest_make_donuts" type="food">
		<welcome text="Witaj w mojej piekarni, gdzie robię ciasto o przepysznej nazwie #pizza oraz #'pączki'!"/>
		<item name="pączek" minutes="3">
			<resource name="mąka"/>
			<resource name="mleko"/>
			<resource name="jajo"/>
			<resource name="osełka masła"/>
			<resource name="cukier"/>

			<activity type="make,zrób,upiecz"/>
		</item>
	</producer>

	<!-- Lena (Gdańsk) -->
	<producer npc="Lena" slot="lena_bake_bread" type="food">
		<welcome text="Witamy serdecznie w naszej pięknie pachnącej pieczywem piekarni!"/>
		<item name="chleb" minutes="6">
			<resource name="mąka" amount="2"/>

			<activity type="bake,upiecz"/>
		</item>
	</producer>

	<!-- Edna (Kraków) -->
	<producer npc="Edna" slot="edna_bake_bread" type="food">
		<welcome text="Witaj w naszej piekarni! Mogę dla ciebie upiec #'chleb'."/>
		<item name="chleb" minutes="7">
			<resource name="mąka" amount="2"/>

			<activity type="bake,upiecz"/>
		</item>
	</producer>

	<!-- Lanosz (Kraków) -->
	<producer npc="Lanosz" slot="lanosz_make_sandwich" type="food">
		<welcome text="Witaj w naszej piekarni! Przyszedłeś skosztować naszych specjalnych #kanapek?"/>
		<item name="kanapka z tuńczykiem" minutes="2">
			<resource name="chleb"/>
			<resource name="tuńczyk" amount="2"/>
			<resource name="pomidor"/>
			<resource name="sałata"/>

			<activity type="make,zrób"/>
		</item>
	</producer>

	<!-- Szef Piotruś (Tarnów) -->
	<producer npc="Szef Piotruś" slot="piotrus_make_potatoes" type="food">
		<welcome text="Witaj! W obecnej chwili wszyscy ludzie wraz z rycerzami są poza miastem. Podejrzewam, że niedługo oni wrócą! Jeśli chciałbyś skosztować moje pyszne ziemniaczki powiedz mi tylko #ugotuj."/>
		<item name="gotowane ziemniaki" quantity="5" minutes="1">
			<resource name="ziemniaki" amount="5"/>
			<resource name="butelka wody" amount="2"/>

			<activity type="make,zrób,ugotuj"/>
		</item>
	</producer>

	<!-- Małgosia (Zakopane) -->
	<producer npc="Małgosia" slot="malgosia_bake_bread" type="food">
		<welcome text="Witaj w piekarni w Zakopanem! Możemy upiec pyszny chleb dla każdego kto pomoże nam przynosząc mąkę z młyna. Powiedz tylko #upiecz."/>
		<item name="chleb" minutes="7">
			<resource name="mąka" amount="2"/>

			<activity type="bake,zrób,upiecz"/>
		</item>
	</producer>

	<!-- Jaś (Zakopane) -->
	<producer npc="Jaś" slot="jas_make_carrot_pie" type="food">
		<welcome text="Witaj w mojej piekarni! Chcesz spróbować moich placków z marchewką? Mogę #upiec jeden dla Ciebie!"/>
		<item name="tarta z marchewką" minutes="4">
			<resource name="mąka"/>
			<resource name="marchew" amount="2"/>
			<resource name="por"/>

			<activity type="bake,zrób,upiecz"/>
		</item>
	</producer>

	<!-- Elwirka (Zakopane) -->
	<producer npc="Elwirka" slot="elwirka_make_dwojaki" type="food">
		<welcome text="Witojcie! Co was tu sprowadza? Pewnie moje legendarne #dwojaki."/>
		<item name="dwojaki" minutes="5">
			<resource name="ziemniaki" amount="3"/>
			<resource name="kiełbasa wiejska" amount="3"/>
			<resource name="cebula"/>
			<resource name="osełka masła"/>
			<resource name="mleko"/>

			<activity type="make,zrób,ugotuj"/>
		</item>
	</producer>

</producers>